{
  "schemaVersion": 1,
  "messageId": "birth-1",
  "tenantId": "demo",
  "projectId": "Project-A",
  "deviceId": "SIM-001",
  "bootId": "boot-1",
  "bootSeq": 1,
  "sequence": 1,
  "sentAt": "2026-10-22T00:00:00Z",
  "kind": "BIRTH",
  "correlationId": "",
  "payload": {
    "edgeHealth": "EDGE_HEALTHY",
    "controllerHealth": "CONTROLLER_HEALTHY",
    "sensorHealth": "HEALTHY",
    "softwareVersion": "mock-0.5.0",
    "reported": {
      "operatingState": "SILENT",
      "mode": "AUTO",
      "alarmState": "NONE",
      "runtimeTotal": 0,
      "position": {
        "x": 1,
        "y": 2,
        "z": 3
      },
      "load": 2.5
    }
  }
}
